{
  "schemaVersion": "1.0",
  "slug": "example-collection",
  "title": "Example Collection",
  "description": "A minimal valid collection file. Replaced with a real AI Engineer World's Fair collection in T18.",
  "author": {
    "name": "Denver Peterson",
    "url": "https://denverpeterson.com"
  },
  "source": {
    "type": "curated",
    "homepage": "https://www.ai.engineer/"
  },
  "refreshInterval": "6h",
  "defaultRanking": "views",
  "videos": [
    {
      "youtubeUrl": "https://www.youtube.com/watch?v=dQw4w9WgXcQ",
      "speakers": [
        { "name": "Speaker Name", "slug": "speaker-name" }
      ],
      "event": {
        "name": "AI Engineer World's Fair",
        "year": 2026,
        "city": "San Francisco"
      },
      "track": "Agents",
      "topics": ["agents", "context-engineering"],
      "organizations": ["Example Company"],
      "featured": false,
      "addedAt": "2026-07-18T00:00:00Z"
    }
  ]
}
